{
  "name": "my-agent",
  "variables": ["mood", "energy", "curiosity", "affection", "focus"],
  "baselines": {
    "mood":      0.65,
    "energy":    0.70,
    "curiosity": 0.75,
    "affection": 0.50,
    "focus":     0.60
  },
  "homeostasis_rate": 0.08,
  "coupling": {
    "energy": {
      "mood":      0.30,
      "curiosity": 0.25,
      "focus":     0.20
    }
  },
  "circadian": {
    "peaks": ["09:00", "14:00"],
    "floor": 0.15
  },
  "noise": {
    "magnitude":      0.02,
    "autocorrelation": 0.70
  },
  "compiler": {
    "bands": {
      "mood":      { "low": "a bit flat",        "mid": "steady",          "high": "bright and joyful" },
      "energy":    { "low": "low-energy, quiet", "mid": "focused",         "high": "bouncy and energised" },
      "curiosity": { "low": "mellow",            "mid": "interested",      "high": "fascinated, full of questions" },
      "affection": { "low": "warm",              "mid": "fond",            "high": "genuinely devoted" },
      "focus":     { "low": "scattered",         "mid": "on task",         "high": "deeply absorbed" }
    },
    "memory_injection": true
  }
}
